{
  "contract": {
    "name": "hausman-hub-climate-current-setup",
    "version": 1
  },
  "generated_at": 1784280000000,
  "snapshot_revision": 6054509084155116,
  "setup_revision": 8116526807461590,
  "status": "ready",
  "editing_allowed": true,
  "display_names": {
    "statuses": {
      "not_configured": "Ещё не настроен",
      "ready": "Можно редактировать",
      "attention": "Нужно проверить устройства"
    },
    "modes": {
      "disabled": "Выключен в HausmanHub",
      "observe": "Только наблюдение",
      "automatic": "Автоматическое управление"
    },
    "strategies": {
      "soft": "Плавно",
      "normal": "Обычно",
      "aggressive": "Быстро"
    },
    "profiles": {
      "day": "День",
      "night": "Ночь"
    },
    "issues": {
      "not_configured": "Климатический контур ещё не настроен.",
      "data_stale": "Данные об устройствах устарели. Обновите экран.",
      "source_missing": "Настроенное устройство больше не найдено.",
      "device_unavailable": "Настроенное устройство сейчас недоступно.",
      "registry_mismatch": "Привязка настроенного устройства изменилась.",
      "unsupported_device": "Тип настроенного устройства больше не поддерживается."
    }
  },
  "name": "Климат дома",
  "mode": "automatic",
  "schedule": {
    "enabled": true,
    "day_start": "07:00",
    "night_start": "23:00",
    "last_applied_profile": "day"
  },
  "rooms": [
    {
      "id": "kids",
      "name": "Kids",
      "devices": [
        {
          "candidate_id": "candidate_0001",
          "name": "Kids humidifier",
          "type": "humidifier",
          "type_name": "Увлажнитель",
          "control_channel": null
        }
      ],
      "profiles": {
        "day": {
          "target_temperature": 24.0,
          "target_humidity": 50,
          "strategy": "soft"
        },
        "night": {
          "target_temperature": 21.0,
          "target_humidity": 45,
          "strategy": "normal"
        },
        "active_profile": "day"
      },
      "min_temperature": null,
      "max_temperature": null,
      "temporary_temperature": null
    },
    {
      "id": "living",
      "name": "Living room",
      "devices": [
        {
          "candidate_id": "candidate_0002",
          "name": "Living AC",
          "type": "air_conditioner",
          "type_name": "Кондиционер",
          "control_channel": null
        }
      ],
      "profiles": {
        "day": {
          "target_temperature": 25.0,
          "target_humidity": 45,
          "strategy": "normal"
        },
        "night": {
          "target_temperature": 22.0,
          "target_humidity": 40,
          "strategy": "soft"
        },
        "active_profile": "day"
      },
      "min_temperature": null,
      "max_temperature": null,
      "temporary_temperature": 23.5
    }
  ],
  "issues": [],
  "summary": {
    "room_count": 2,
    "device_count": 2
  }
}
